{
  "$schema": "../SCHEMAS/source-domain-mapping.schema.json",
  "schemaVersion": "agm-source-domain-mapping.v1",
  "mappingVersion": "1.1.0",
  "generatedAt": "2026-08-29T21:19:48.538Z",
  "centralRegistry": "AGM_LIBRARY/REGISTRY/canonical-sources.json",
  "sourceCount": 815,
  "membershipCount": 1487,
  "sources": [
    {
      "sourceId": "CM-497467A0DEF02126",
      "domains": [
        "car-mover"
      ],
      "membershipIds": [
        "DM-DF2B3E6089C40600F540"
      ]
    },
    {
      "sourceId": "CM-0FAA1E7358C50EC3",
      "domains": [
        "car-mover"
      ],
      "membershipIds": [
        "DM-CF590417C9EAA1582032"
      ]
    },
    {
      "sourceId": "CM-D9D5E21BA217DC68",
      "domains": [
        "car-mover"
      ],
      "membershipIds": [
        "DM-61D38E63DCC0CACD4E35"
      ]
    },
    {
      "sourceId": "CM-C8F7F56B5D7709EE",
      "domains": [
        "car-mover"
      ],
      "membershipIds": [
        "DM-0705CA1E084DB0AB5F2C"
      ]
    },
    {
      "sourceId": "CM-199DD7DC0884E3D6",
      "domains": [
        "car-mover"
      ],
      "membershipIds": [
        "DM-59E2985D0112A3D63430"
      ]
    },
    {
      "sourceId": "CM-E58D13A8651D730B",
      "domains": [
        "car-mover"
      ],
      "membershipIds": [
        "DM-51CE71C09683FC594EB9"
      ]
    },
    {
      "sourceId": "CM-EF097B4B6D8CED56",
      "domains": [
        "car-mover"
      ],
      "membershipIds": [
        "DM-37779448240F620FF0E1"
      ]
    },
    {
      "sourceId": "CM-EE55D0C7A349FA99",
      "domains": [
        "car-mover"
      ],
      "membershipIds": [
        "DM-BE58580CAEDAD90375F2"
      ]
    },
    {
      "sourceId": "CM-34579D4E93861E4C",
      "domains": [
        "car-mover"
      ],
      "membershipIds": [
        "DM-C7AF8EF22E70558BEF78"
      ]
    },
    {
      "sourceId": "CM-36855EB83A58C773",
      "domains": [
        "car-mover"
      ],
      "membershipIds": [
        "DM-B129E8C8BD9CFFDE0B69"
      ]
    },
    {
      "sourceId": "CM-480898D023166C13",
      "domains": [
        "car-mover"
      ],
      "membershipIds": [
        "DM-7C78677D022822E3AA60"
      ]
    },
    {
      "sourceId": "CM-0767A7A22285249D",
      "domains": [
        "car-mover"
      ],
      "membershipIds": [
        "DM-92DD88FFFC59FA16CD7E"
      ]
    },
    {
      "sourceId": "CM-8FF5AF70C05549BB",
      "domains": [
        "car-mover"
      ],
      "membershipIds": [
        "DM-7703CE5093C8932E1ED8"
      ]
    },
    {
      "sourceId": "CM-6AC68E845887A59C",
      "domains": [
        "car-mover"
      ],
      "membershipIds": [
        "DM-BDEBDC8614D9B8FE63B7"
      ]
    },
    {
      "sourceId": "CM-8BDE383D45D0D2DB",
      "domains": [
        "car-mover"
      ],
      "membershipIds": [
        "DM-4E0100E47544A3ED5163"
      ]
    },
    {
      "sourceId": "CM-8B36B99E4C7B8190",
      "domains": [
        "car-mover"
      ],
      "membershipIds": [
        "DM-80B386D3E539B0AD19CB"
      ]
    },
    {
      "sourceId": "CM-3C842A81ABACF1E0",
      "domains": [
        "car-mover"
      ],
      "membershipIds": [
        "DM-9A8FA40BF49C4336DC58"
      ]
    },
    {
      "sourceId": "CM-2D52E8A8EA773397",
      "domains": [
        "car-mover",
        "routing-toll"
      ],
      "membershipIds": [
        "DM-24F76333116A07DFF348",
        "DM-F450A38FE988BCF2C15A"
      ]
    },
    {
      "sourceId": "CM-293194C2B2C8EA1C",
      "domains": [
        "car-mover"
      ],
      "membershipIds": [
        "DM-F0055F18FF6495D8508C"
      ]
    },
    {
      "sourceId": "CM-4B0DD14187D6D955",
      "domains": [
        "car-mover"
      ],
      "membershipIds": [
        "DM-B636E903C4CF7561DEAC"
      ]
    },
    {
      "sourceId": "CM-FFFF153F68A02C89",
      "domains": [
        "car-mover"
      ],
      "membershipIds": [
        "DM-9C20F39EE73416EF6FBC"
      ]
    },
    {
      "sourceId": "CM-A8B16D0C3ADB7A77",
      "domains": [
        "car-mover"
      ],
      "membershipIds": [
        "DM-9F4E1D358C719AE15040"
      ]
    },
    {
      "sourceId": "CM-00D9D74EE16147BD",
      "domains": [
        "car-mover"
      ],
      "membershipIds": [
        "DM-5B6D0C3CFC4E3DEE01AA"
      ]
    },
    {
      "sourceId": "CM-48BF38FD899F57C9",
      "domains": [
        "car-mover"
      ],
      "membershipIds": [
        "DM-1E71510559A343BD7959"
      ]
    },
    {
      "sourceId": "CM-43525D2DD7941F78",
      "domains": [
        "car-mover"
      ],
      "membershipIds": [
        "DM-14CA6647283509C8A156"
      ]
    },
    {
      "sourceId": "CM-0AC2D53D0F558DF6",
      "domains": [
        "car-mover"
      ],
      "membershipIds": [
        "DM-0EA901796CAD94887A85"
      ]
    },
    {
      "sourceId": "CM-B5ED229EA76E8689",
      "domains": [
        "car-mover"
      ],
      "membershipIds": [
        "DM-11486DC0941869B22A26"
      ]
    },
    {
      "sourceId": "CM-5A6D975D0F734129",
      "domains": [
        "car-mover",
        "routing-toll"
      ],
      "membershipIds": [
        "DM-304C560D716E5F4D89D0",
        "DM-C3A7DA048DBAD874E5D9"
      ]
    },
    {
      "sourceId": "CM-7FAA3D96EE250D32",
      "domains": [
        "car-mover"
      ],
      "membershipIds": [
        "DM-122342E9D221FBA9A489"
      ]
    },
    {
      "sourceId": "CM-16725278C7F1475D",
      "domains": [
        "car-mover",
        "routing-toll"
      ],
      "membershipIds": [
        "DM-11ED3206D72B7CFE4D6C",
        "DM-F68D28B19A27CD229FFB"
      ]
    },
    {
      "sourceId": "CM-DDDC20BEB9709270",
      "domains": [
        "car-mover"
      ],
      "membershipIds": [
        "DM-1B98D82088D9C4C4E162"
      ]
    },
    {
      "sourceId": "CM-D9CCAE0B677A779D",
      "domains": [
        "car-mover",
        "routing-toll"
      ],
      "membershipIds": [
        "DM-17BEF501D5A82DD50546",
        "DM-926154447E2DB4760848"
      ]
    },
    {
      "sourceId": "CM-8EB0EF509AA6E06E",
      "domains": [
        "car-mover"
      ],
      "membershipIds": [
        "DM-11F099E7AF3D6E3EC09F"
      ]
    },
    {
      "sourceId": "CM-EBAA05A7E6B4867F",
      "domains": [
        "car-mover"
      ],
      "membershipIds": [
        "DM-CE07B81CB9AD9CF76CF9"
      ]
    },
    {
      "sourceId": "CM-574497E6D15018E0",
      "domains": [
        "car-mover",
        "routing-toll"
      ],
      "membershipIds": [
        "DM-08933F320C32D000EA9D",
        "DM-0B7F3296C089B722E687"
      ]
    },
    {
      "sourceId": "CM-9AAB1D956FEC32C7",
      "domains": [
        "car-mover"
      ],
      "membershipIds": [
        "DM-CEA3AD0A7BBB4F5C8DFB"
      ]
    },
    {
      "sourceId": "CM-28864025206B3C0A",
      "domains": [
        "car-mover"
      ],
      "membershipIds": [
        "DM-2D1E597CDF10FFD1C39C"
      ]
    },
    {
      "sourceId": "CM-4DE6408AF075DC0C",
      "domains": [
        "car-mover",
        "routing-toll"
      ],
      "membershipIds": [
        "DM-29AC54BC5503F99627E8",
        "DM-3B25087E5E9205B51FAD"
      ]
    },
    {
      "sourceId": "CM-DAAF3DB118E514EA",
      "domains": [
        "car-mover"
      ],
      "membershipIds": [
        "DM-08261433FF9D0D5AA52A"
      ]
    },
    {
      "sourceId": "CM-3895E547491AD592",
      "domains": [
        "car-mover"
      ],
      "membershipIds": [
        "DM-56B7C8BB0B5A6E393E42"
      ]
    },
    {
      "sourceId": "CM-601998C647021764",
      "domains": [
        "car-mover",
        "routing-toll"
      ],
      "membershipIds": [
        "DM-4D6F37D7CE4236776E3D",
        "DM-F2E87FC161944E8D01D1"
      ]
    },
    {
      "sourceId": "CM-BD17175570765254",
      "domains": [
        "car-mover"
      ],
      "membershipIds": [
        "DM-2573D18041B4B97414AB"
      ]
    },
    {
      "sourceId": "CM-94D465669D14D66D",
      "domains": [
        "car-mover"
      ],
      "membershipIds": [
        "DM-768C9509E4CCAE5393FB"
      ]
    },
    {
      "sourceId": "CM-7BAAEE6661DD6F80",
      "domains": [
        "car-mover",
        "routing-toll"
      ],
      "membershipIds": [
        "DM-B24CC4B5C81A8C7C5598",
        "DM-B84B070253E9E811B33C"
      ]
    },
    {
      "sourceId": "CM-36C035582C54AA93",
      "domains": [
        "car-mover"
      ],
      "membershipIds": [
        "DM-4C7F3646960A70B08CA2"
      ]
    },
    {
      "sourceId": "CM-6B22F31085BBCCCD",
      "domains": [
        "car-mover"
      ],
      "membershipIds": [
        "DM-6DB46A844551A2E04B9E"
      ]
    },
    {
      "sourceId": "CM-807A9EDF4D53692B",
      "domains": [
        "car-mover",
        "routing-toll"
      ],
      "membershipIds": [
        "DM-06D5927C4C4C76BC00D8",
        "DM-7AF2786664CD03A37ADF"
      ]
    },
    {
      "sourceId": "CM-05175583D98647B7",
      "domains": [
        "car-mover"
      ],
      "membershipIds": [
        "DM-8566B588A362212CBBED"
      ]
    },
    {
      "sourceId": "CM-8183DBF2C59ECFBC",
      "domains": [
        "car-mover"
      ],
      "membershipIds": [
        "DM-6B65DDE55D3EC9F9555B"
      ]
    },
    {
      "sourceId": "CM-1370B93A002C0BF7",
      "domains": [
        "car-mover",
        "common-platform"
      ],
      "membershipIds": [
        "DM-5AA4BD328939BD7F0FA8",
        "DM-D84EF8A33432909B0145"
      ]
    },
    {
      "sourceId": "CM-821BBD18A87A4922",
      "domains": [
        "car-mover",
        "routing-toll"
      ],
      "membershipIds": [
        "DM-44F4EB811DD4BF30A1E6",
        "DM-A7063E67F14D2735BEF6"
      ]
    },
    {
      "sourceId": "CM-29B455C498CB8D4A",
      "domains": [
        "car-mover"
      ],
      "membershipIds": [
        "DM-53F9581CF7374A77BA02"
      ]
    },
    {
      "sourceId": "CM-9D592A98F5A74CC8",
      "domains": [
        "car-mover"
      ],
      "membershipIds": [
        "DM-8695B47213EE7DD9FCC2"
      ]
    },
    {
      "sourceId": "CM-6646C34A80300769",
      "domains": [